{
  "$schema": "https://json-schema.org/draft/2020-12/schema",
  "$id": "https://ainumbers.co/helm/schema/objects/disclosure_receipt.schema.json",
  "title": "Control Plane Profile — object kind: disclosure_receipt (SPEC.md §26.4, reserved-†)",
  "description": "Reserved in ocg-control-plane@1: schema is normative, production is OPTIONAL (Helm Phase 2+). A @1 verifier MUST parse and verify this if it encounters one. Records that evidence/data was released to a named recipient under a stated redaction profile.",
  "$defs": {
    "sha256ref": { "type": "string", "pattern": "^sha256:[0-9a-f]{64}$" },
    "timestamp": { "type": "string", "pattern": "^\\d{4}-\\d{2}-\\d{2}T\\d{2}:\\d{2}:\\d{2}(\\.\\d+)?Z$" }
  },
  "type": "object",
  "additionalProperties": false,
  "required": [
    "run_id", "workflow_manifest_digest", "recorded_at",
    "recipient", "purpose", "released_digests", "redaction_profile"
  ],
  "properties": {
    "run_id": { "type": "string", "minLength": 1 },
    "workflow_manifest_digest": { "$ref": "#/$defs/sha256ref" },
    "recorded_at": { "$ref": "#/$defs/timestamp" },
    "recipient": { "type": "string", "minLength": 1 },
    "purpose": { "type": "string", "minLength": 1 },
    "released_digests": { "type": "array", "minItems": 1, "items": { "$ref": "#/$defs/sha256ref" } },
    "redaction_profile": { "type": "string", "minLength": 1 }
  }
}
