{
  "run_id": "run-9f1c2b",
  "workflow_manifest_digest": "sha256:cf34ecd7b8eeff090b776cb06ab3742e15e4b739e7f6eac14d7fb02d2999c5b7",
  "recorded_at": "2026-07-23T06:00:09Z",
  "recipient": "external-auditor@bigfour.example",
  "purpose": "regulatory-audit",
  "released_digests": [],
  "redaction_profile": "default-v1"
}
